{"schema_version":"purplesploit/canonical/1","engagement":{"id":"e1","name":"Fixture"},"assessment":null,"assets":[{"id":"a1","target":"192.0.2.1"},{"id":"a2","target":"192.0.2.2"}],"services":[],"identities":[],"resources":[],"executions":[],"observations":[],"findings":[{"id":"f1","title":"Fixture finding","severity":"high","target":"192.0.2.1","extensions":{"source_fields":{"future":{"keep":true}}}}],"evidence":[],"graph":{"nodes":[],"edges":[],"extensions":{}},"extensions":{"source_fields":{"future_document":{"keep":true}}}}
